{
  "port": 7804,
  "advertised_ipv4": "127.0.0.1",
  "self_base_url": "https://127.0.0.1:7804",
  "sbi_bind_address": "0.0.0.0",
  "metrics_bind_address": "0.0.0.0:9490",
  "nrf_base_url": "https://127.0.0.1:7777",
  "redis_url": "tcp://127.0.0.1:6379",
  "nrf_heartbeat_seconds": 30,
  "dccf_base_url": "https://127.0.0.1:7803",
  "nwdaf_base_url": "https://127.0.0.1:7798",
  "data_store": {
    "host": "127.0.0.1",
    "port": 9030,
    "user": "root",
    "password": "",
    "database": "adrf_data",
    "max_rows": 1000
  },
  "ml_model_store_database_url": "postgresql://adrf:adrf@127.0.0.1:5438/adrf",
  "storage_policy": {
    "default_lifetime_seconds": 86400,
    "max_lifetime_seconds": 2592000,
    "alert_lead_seconds": 60,
    "alert_grace_seconds": 300,
    "reaper_interval_seconds": 10
  },
  "retrieval": {
    "fetch_buffer_ttl_seconds": 300,
    "sweep_interval_seconds": 10
  },
  "ml_model_access_policy": "enforced",
  "ml_model_download_max_bytes": 268435456,
  "oauth2_required": true
}
